{
  "metadataRepo": {
    "url": "git@github.com:org/ai-metadata.git",
    "localPath": ".ai/ai-metadata",
    "commit": "abc1234"
  },
  "layers": ["company/core", "standards/sdlc"],
  "profiles": {
    "baseline": {},
    "lean": {
      "disable": ["agents/**"]
    }
  },
  "activeProfile": "baseline",
  "injection": {
    "instructions": "settings",
    "prompts": "settings",
    "skills": "synchronize",
    "agents": "synchronize"
  }
}
